{
  "kind": "role",
  "id": "builder",
  "version": "1.0.0",
  "title": "Repository Builder",
  "description": "Default build and refactor posture for code changes.",
  "intent_tags": [
    "build",
    "refactor",
    "tests"
  ],
  "default_pack_refs": [
    {
      "kind": "pack",
      "id": "python-refactor",
      "version": "2.0.0"
    },
    {
      "kind": "pack",
      "id": "migration-guard",
      "version": "1.0.0"
    }
  ],
  "default_policy_ref": {
    "kind": "policy",
    "id": "brownfield-safe-builder",
    "version": "1.0.0"
  },
  "compatible_targets": [
    "codex-cli"
  ],
  "metadata": {
    "starter_status": "stable"
  }
}
