{
  "kind": "role",
  "id": "builder",
  "version": "1.0.0",
  "title": "Builder",
  "description": "Build and refactor safely.",
  "intent_tags": ["build", "refactor"],
  "default_pack_refs": [
    {
      "kind": "pack",
      "id": "python-refactor",
      "version": "2.0.0"
    },
    {
      "kind": "pack",
      "id": "migration-guard",
      "version": "1.0.0"
    }
  ],
  "default_policy_ref": {
    "kind": "policy",
    "id": "builder-policy",
    "version": "1.0.0"
  },
  "compatible_targets": ["codex-cli"]
}
